keyword,status,library_id,date,page_name,page_link,sponsored,ad_text,media_url
slot_machine,Inactive,1050390463811306,9 Apr 2025 - 29 Jun 2025,Slotomania - Slot Machines,https://www.facebook.com/slotomania/,Yes,"🎰Come Back Now, Spin 50 times, AND GET CiviliTreasures Game Mania for 24 Hours 🔥🤑",https://scontent.fpnh1-2.fna.fbcdn.net/v/t39.35426-6/490109690_1229705634658552_3503664659239900315_n.jpg?stp=dst-jpg_s600x600_tt6&_nc_cat=111&ccb=1-7&_nc_sid=c53f8f&_nc_ohc=K3fe2D-ai0UQ7kNvwGyVjvH&_nc_oc=AdpGHYGxZLt-ukuSVrQ6fQQY6_UaEHNacRE-wXQ6d4eLxb92_MeJv8OANEjnCQM4XxM&_nc_zt=14&_nc_ht=scontent.fpnh1-2.fna&_nc_gid=noe3YVXvbiiqtnd7pN-IfA&_nc_ss=7f289&oh=00_Af4PxO8U79Wqu7kuK0RYOv5Fm8I6NcyrrU_CQMSyhnkZjA&oe=6A07DCDA
slot_machine,Inactive,689635457459526,20 Aug 2025 - 23 Aug 2025,INAIR,https://www.facebook.com/inairglass/,Yes,"🎰 #LuckyDraw Your gameplay could turn into real-life rewards✨

1️. Watch the slot machine spin
2️️. Screenshot your result
3️️. Drop it in the comments

Land 3 #INAIR2Pro 👓 = win a mystery gift
Land 3 different icons 💰 = DM us for a $30 discount on INAIR 2 Pro

With #INAIR, games don’t just stay on your screen, they leap into your world in full 3D. 
🔗 Click  to discover more

#3Dgaming #Gamescom #Gamescom2025 #ARglasses #Giveaway",https://video.fpnh1-2.fna.fbcdn.net/o1/v/t2/f2/m366/AQNzx05pM6qOeHzCRyg1VPlFML6g9WriYSCtjrfdVNKaRGygR26KA-qy8isZjgEgSa7VgmwBcg26969saXjML9YpkRoA-FfTscFNm-BOBw.mp4?_nc_cat=111&_nc_oc=AdoW9ruaQGKphzKkkO6P-r027vsMnGYb82IoCleDDc8Wn93XRUe6FJ9NHFBNdR_AvV0&_nc_sid=8bf8fe&_nc_ht=video.fpnh1-2.fna.fbcdn.net&_nc_ohc=tW_JLbPAkxMQ7kNvwH2jFH7&efg=eyJ2ZW5jb2RlX3RhZyI6Inhwdl9wcm9ncmVzc2l2ZS5WSV9VU0VDQVNFX1BST0RVQ1RfVFlQRS4uQzMuMzYwLnN2ZV9zZCIsInhwdl9hc3NldF9pZCI6NzY0OTkzMjU5NjE2NDEyLCJhc3NldF9hZ2VfZGF5cyI6MjY0LCJ2aV91c2VjYXNlX2lkIjoxMDEyMiwiZHVyYXRpb25fcyI6OCwidXJsZ2VuX3NvdXJjZSI6Ind3dyJ9&ccb=17-1&_nc_gid=noe3YVXvbiiqtnd7pN-IfA&_nc_ss=7f289&_nc_zt=28&oh=00_Af49IDGOoENayWpx-aWxKpGnaK_NX5TZ02_ac_REx3GufQ&oe=6A07EFBB
slot_machine,Inactive,1283030086477431,10 Sep 2025 - 14 Nov 2025,Slotomania - Slot Machines,https://www.facebook.com/slotomania/,Yes,"🎰🎉Have you met our brand new Cleopatra II Slot Machine, Straight from the Casino Floors?!🎉🎰
Spin NOW🎁",https://scontent.fpnh1-2.fna.fbcdn.net/v/t39.35426-6/538902419_1070459048218038_7858591724546077205_n.jpg?stp=dst-jpg_s600x600_tt6&_nc_cat=108&ccb=1-7&_nc_sid=c53f8f&_nc_ohc=IYX5EqRA_n0Q7kNvwElMewV&_nc_oc=AdquUtFMhcr4hTblv3DfCxJ9GNp6zbmubVxUlhKTszAfaACRzHeN5B36BX01KoeCmIM&_nc_zt=14&_nc_ht=scontent.fpnh1-2.fna&_nc_gid=noe3YVXvbiiqtnd7pN-IfA&_nc_ss=7f289&oh=00_Af6odP8caj2csfqvvnoz32jjt6YGfZXxZqRTcfujvblmbQ&oe=6A07C820
slot_machine,Inactive,1420068729102429,31 Aug 2025 - 23 Feb 2026,Slots Bingo Free,https://www.facebook.com/SlotsBingoFree/,Yes,🎰 Play The Best SLOT-Machine GAMES!,https://scontent.fpnh1-1.fna.fbcdn.net/v/t39.35426-6/537883298_1175888027714659_3912575513231304257_n.jpg?stp=dst-jpg_s600x600_tt6&_nc_cat=107&ccb=1-7&_nc_sid=c53f8f&_nc_ohc=kedFDhpduQsQ7kNvwEMAypR&_nc_oc=AdodbQ7BPmjna3dfi-tYBmuXUqZ0ptVvVxH7ymIdgfIrvkaW50cRreeyjpoXQ1YndDM&_nc_zt=14&_nc_ht=scontent.fpnh1-1.fna&_nc_gid=noe3YVXvbiiqtnd7pN-IfA&_nc_ss=7f289&oh=00_Af7WJCmBNlkkYafCF36ne-HN5yw1yTuiAsyoSmq1O_5UGQ&oe=6A07DB03
slot_machine,Inactive,1613146482672478,1 Apr 2025 - 4 Jun 2025,Slotomania - Slot Machines,https://www.facebook.com/slotomania/,Yes,"🎰🎉Have you met our brand new Cleopatra II Slot Machine, Straight from the Casino Floors?!🎉🎰
Spin NOW🎁",https://scontent.fpnh1-1.fna.fbcdn.net/v/t39.35426-6/474531417_1373319980499380_878257038094753615_n.jpg?stp=dst-jpg_s600x600_tt6&_nc_cat=105&ccb=1-7&_nc_sid=c53f8f&_nc_ohc=E_8f-oCv9QEQ7kNvwH6I1cX&_nc_oc=AdrAPbjqkLSqkaYwPMC-iQnnCoFoDJXOUHdAZTf8CPel4pq0lb1jnbULl7l4zYMCyKY&_nc_zt=14&_nc_ht=scontent.fpnh1-1.fna&_nc_gid=noe3YVXvbiiqtnd7pN-IfA&_nc_ss=7f289&oh=00_Af4HQZGqXoa45l9un84ai5wJUxuy3QEYgLA9Wq7s25i5IA&oe=6A07DB68
slot_machine,Inactive,1552995403503294,17 Mar 2026 - 9 Apr 2026,Starter School,https://www.facebook.com/mystarterschool/,Yes,"I’ve been tracking A.I. developments since 2020 and what I’m seeing now is alarming. Most schools are stuck not knowing what to do.

And it's worse now... because in the last 6 weeks, there are 2 major A.I. upgrades that made Silicon Valley engineers say: ""oh crap..  coders are in trouble…”

Something so simple that a 9-year-old could run circles around most adults with it.

#1: The rise of ""A.I. Worker"" Bots—also known as A.I. agents.

#2: A new type of A.I. that codes better and faster than even the best software engineers at NASA

For this reason, I'm hosting a one-time live stream discussion on Zoom titled:

""How To Future-Proof Your Teenager's Education In The Face Of New A.I. Advancements""

You'll Discover:

◆  The 2 A.I. upgrades from the last 6 weeks that made engineers say ""oh crap""—and why one keeps looping until your kid's future job is done.

◆ Why the phrase ""learn to code"" is now terrible advice for your teenager (and what to tell them instead before they waste 4 years on a degree that's being automated as you read this).

◆ 18 industries your teen should avoid at all costs—including 3 that guidance counselors are still pushing as ""safe careers.""

◆ How smart is A.I. in 2026? I'll show you something live that will make your stomach drop. Most parents have no idea what their kids are competing against.

◆ What ""A.I.-resistant education"" actually means when your teen is 16—not theory, not buzzwords, but the specific skills that can't be automated in the next decade. (And no, it's definitely NOT coding.)

◆ Why ""getting good grades"" is now the educational equivalent of getting really good at operating a fax machine.

Register by tapping on this post and selecting one of the two time slots.

📹 Even if you can't make it, make sure to still register so you get the replay and reminders.

If you CAN make it live, you'll be glad there's a Live Q&A… because I know there will be questions on your mind you'd like answers to. 💬

Tap on the post and select one of the time slots.

Our Zoom plan only has 200 spots so register now and set a reminder so you don't miss it.",https://video.fpnh1-1.fna.fbcdn.net/o1/v/t2/f2/m412/AQN-b5bfosrNjUliXsODtlrEsEjKZScDYEzqKr7fgAG5kQ23iL-N4ErXY24fQ9WdsBE2DLen1F-1fy7umTPWfGZ-pcSiwEZtPPBZgAscEQ.mp4?_nc_cat=107&_nc_oc=Adq19TwvS_xhJvZRYN1Ez7dsqgt9uGGaiWPgdnvuJqldiCi2yCrvY2vaZXJ43DCbbUk&_nc_sid=8bf8fe&_nc_ht=video.fpnh1-1.fna.fbcdn.net&_nc_ohc=pvkLJN28p_AQ7kNvwEYQFZc&efg=eyJ2ZW5jb2RlX3RhZyI6Inhwdl9wcm9ncmVzc2l2ZS5WSV9VU0VDQVNFX1BST0RVQ1RfVFlQRS4uQzMuMzYwLnN2ZV9zZCIsInhwdl9hc3NldF9pZCI6MjAxNzQxMjg1NTgxNTE3MiwiYXNzZXRfYWdlX2RheXMiOjc1LCJ2aV91c2VjYXNlX2lkIjoxMDc5OSwiZHVyYXRpb25fcyI6NDYsInVybGdlbl9zb3VyY2UiOiJ3d3cifQ%3D%3D&ccb=17-1&_nc_gid=noe3YVXvbiiqtnd7pN-IfA&_nc_ss=7f289&_nc_zt=28&oh=00_Af5StMDBaLmag7EU9NjidP7o-NDTzQxc1NMPqnMDk9UgtQ&oe=6A07E79B
slot_machine,Inactive,2035163450367723,1 May 2026 - 2 May 2026 · Total active time 2 hrs,Canton Fair,https://www.facebook.com/CantonFairOnline/,Yes,"Intelligent Healthcare, Medicines, Health Products and Medical DevicesWhat's new in the era of comprehensive health?
How is intelligent healthcare making health management more efficient?
JOIN LIVE NOW!Exhibition Live Tour",
slot_machine,Inactive,701358372809425,30 Jun 2025 - 23 Feb 2026,Apps-4-Free,https://www.facebook.com/GameApps4Free/,Yes,🍀 The Best SLOT-Machine GAMES! 🍀,https://scontent.fpnh1-1.fna.fbcdn.net/v/t39.35426-6/514315666_1358948168533892_4977837267997971666_n.jpg?stp=dst-jpg_s600x600_tt6&_nc_cat=104&ccb=1-7&_nc_sid=c53f8f&_nc_ohc=XNLJRRwQ4xkQ7kNvwHqNxwM&_nc_oc=Adqt72bfTf-iryTfxnXBVCLKEWbTb-4B6YixMLrGKfh7UP_qyYIojq1zlf_HXvh1DXA&_nc_zt=14&_nc_ht=scontent.fpnh1-1.fna&_nc_gid=noe3YVXvbiiqtnd7pN-IfA&_nc_ss=7f289&oh=00_Af7hEqRiJIEUEKmTYDKapZReNCzwqkmEOni82JQYlLX3mg&oe=6A07F7F4
slot_machine,Inactive,1235568484612606,3 Jun 2025 - 24 Feb 2026,Slots Bingo Free,https://www.facebook.com/SlotsBingoFree/,Yes,🎰 Play The Best SLOT-Machine GAMES!,https://scontent.fpnh1-1.fna.fbcdn.net/v/t39.35426-6/503519216_1362022895090227_1280079566317287350_n.jpg?stp=dst-jpg_s600x600_tt6&_nc_cat=107&ccb=1-7&_nc_sid=c53f8f&_nc_ohc=SfqLcwthjlAQ7kNvwFCRtfH&_nc_oc=Adr8nlOKLT_AqBSP57MOiBc0b44o08coAUvwGrIrDIXsw1g2lwA-X7UlYWkjQdUseKw&_nc_zt=14&_nc_ht=scontent.fpnh1-1.fna&_nc_gid=noe3YVXvbiiqtnd7pN-IfA&_nc_ss=7f289&oh=00_Af5ilcH9wGAYYGq0QLxRWgcR4pqpXhzrP3G_o1qVWm1PtA&oe=6A07ECFD
slot_machine,Inactive,566864376401471,26 Feb 2025 - 14 May 2025,Jackpot Crush Featuring IGT,https://www.facebook.com/100090784806069/,Yes,"🔥 15,000,000 Welcome Free Coins 🔥
💎Countless AMAZING themes💎
😍 Try Your Luck and Play It NOW 😍",https://video.fpnh1-1.fna.fbcdn.net/o1/v/t2/f2/m69/AQMSgbtd26j38wPpe-NTCcZ5g5I_V5qMe4PZQW1ocSql7AztKCyxNdDkPXAVlc0UBgKpvIHQGiy5gGoCRdxVwTw9.mp4?strext=1&_nc_cat=104&_nc_oc=Adr7FttiAh-chJ1UM7CvPgN7XBCrkptDovJOBUcxkQ6omiE-nKxzvbQJD20Ma3JFpHs&_nc_sid=8bf8fe&_nc_ht=video.fpnh1-1.fna.fbcdn.net&_nc_ohc=CZMfQTyduGwQ7kNvwFsimED&efg=eyJ2ZW5jb2RlX3RhZyI6Inhwdl9wcm9ncmVzc2l2ZS5WSV9VU0VDQVNFX1BST0RVQ1RfVFlQRS4uQzMuMzYwLmFzaWNfaHExX3NkX3Byb2dyZXNzaXZlIiwieHB2X2Fzc2V0X2lkIjoxNzMxMTI0NTE0MjIyOTIwLCJhc3NldF9hZ2VfZGF5cyI6MTc0LCJ2aV91c2VjYXNlX2lkIjoxMDY4MCwiZHVyYXRpb25fcyI6NTMsInVybGdlbl9zb3VyY2UiOiJ3d3cifQ%3D%3D&ccb=17-1&_nc_gid=noe3YVXvbiiqtnd7pN-IfA&_nc_ss=7f289&_nc_zt=28&oh=00_Af4ua39eUixL-2Erds9jVjIyqTMI8KbCDiPzU4woLKoOug&oe=6A07C802
slot_machine,Inactive,1212286390695064,2 Jul 2025 - 9 Jul 2025,TCN Vending Machine,https://www.facebook.com/TCNVendingMachine/,Yes,"Track It. Control It. Sell It. Slot by Slot.

📦 Gentle XY-axis delivery—fast, smooth, and damage-free.
➕Perfect for mixed-size items like hot food, drinks, or stationery.
✅ High accuracy, fewer errors, smoother vending.
💳 Multiple payment options—card, coin, cash & more.

E-mail: info@tcnvending.com
WhatsApp/Phone number: +86 18774863821

#SmartVending #VendingMachine #NextGenVending #IntelligentVending #SlotBySlot #RetailTech #AutomatedRetail #TechDrivenRetail #ModularVending #PrecisionVending #VendingInnovation #CustomVending #VendingSolutions #FutureOfRetail",https://scontent.fpnh1-2.fna.fbcdn.net/v/t39.35426-6/514403817_740546478921708_4228266908841197841_n.jpg?stp=dst-jpg_s600x600_tt6&_nc_cat=109&ccb=1-7&_nc_sid=c53f8f&_nc_ohc=JH4dGtwfOwYQ7kNvwFx4zxK&_nc_oc=AdrCqZYBKjfD-GmD_oj9jOA0Wqxk5Rqh_pTu3UyxMq5eRm7dMHd-hPwJR1zak6NF8jM&_nc_zt=14&_nc_ht=scontent.fpnh1-2.fna&_nc_gid=noe3YVXvbiiqtnd7pN-IfA&_nc_ss=7f289&oh=00_Af4DZ3zmdt8I1AcMLji7xuUcsGlG6sYHols7xwzda5QTMw&oe=6A07D8FA
slot_machine,Inactive,896976182458257,1 Apr 2025 - 3 Aug 2025,Slotomania - Slot Machines,https://www.facebook.com/slotomania/,Yes,"❤JUST FOR YOU! 💰
🎰Spin 50 Times ON ANY SLOT MACHINE🎰
And GET 
🎉CivilTreasures Game Mania Opened for 24 Hours 🎁
We Miss You! Come Back and Enjoy the Mania 🙆‍♀️😍",https://video.fpnh1-2.fna.fbcdn.net/o1/v/t2/f2/m69/AQMoaOK5IWyeqt98CiETbUUDfY90Uvq17v6q0gDljaTGjXm3S6sZlPA-rG-DPEWzaXPmiVzCzY2_7Y13YdBk6td7.mp4?strext=1&_nc_cat=111&_nc_oc=AdoNy14OPvw9TV-raaI1KxUThkDe_YQGIq_NevyVigenJChuAGjV62a7VqgOCnVvlcQ&_nc_sid=8bf8fe&_nc_ht=video.fpnh1-2.fna.fbcdn.net&_nc_ohc=u2fxDfVcv2UQ7kNvwFoAnnk&efg=eyJ2ZW5jb2RlX3RhZyI6Inhwdl9wcm9ncmVzc2l2ZS5WSV9VU0VDQVNFX1BST0RVQ1RfVFlQRS4uQzMuMzYwLnN2ZV9zZCIsInhwdl9hc3NldF9pZCI6NjU1MzY0NTEzODUxNTE0LCJhc3NldF9hZ2VfZGF5cyI6NDExLCJ2aV91c2VjYXNlX2lkIjoxMDc5OSwiZHVyYXRpb25fcyI6MTUsInVybGdlbl9zb3VyY2UiOiJ3d3cifQ%3D%3D&ccb=17-1&_nc_gid=noe3YVXvbiiqtnd7pN-IfA&_nc_ss=7f289&_nc_zt=28&oh=00_Af7q3VWC65YboSeZmLH7OF00f6L9e0jWZISc6ZEXn5L-Tg&oe=6A07EAC7
slot_machine,Inactive,685199434126589,5 Jun 2025 - 22 Feb 2026,Slots Bingo Free,https://www.facebook.com/SlotsBingoFree/,Yes,🎰 Play The Best SLOT-Machine GAMES!,https://scontent.fpnh1-1.fna.fbcdn.net/v/t39.35426-6/499571139_1294715885987007_6135063524568201661_n.jpg?stp=dst-jpg_s600x600_tt6&_nc_cat=102&ccb=1-7&_nc_sid=c53f8f&_nc_ohc=2_F2XH7wGxsQ7kNvwF1nS1E&_nc_oc=Adoiz1BZKNlGDFqL_-62qFh4EUNdSbdAWpLCxvE9iF4oRL8dX2eHrbjPGQ0pmoAQyJU&_nc_zt=14&_nc_ht=scontent.fpnh1-1.fna&_nc_gid=noe3YVXvbiiqtnd7pN-IfA&_nc_ss=7f289&oh=00_Af5rGwoivsnutbhIxVkWEkuvjAPJkKF4Nu5tg6Pgw0rVZg&oe=6A07CC74
slot_machine,Inactive,1884404252474084,31 Oct 2025 - 7 Nov 2025,Webfic- Make Reading Fantastic,https://www.facebook.com/61552616584831/,Yes,"Avery Whitlock was the ideal woman at Northbridge University that all the guys fantasized about.
However, her private photos were suddenly leaked onto the campus forum one day.

Her reputation was shredded overnight, and the university revoked her direct admission to the master's program. When she walked down the street, strangers jeered, ""How much for a night?""

There could only be one person who had those photos—her boyfriend, Julian Mercer.

Avery ran to Julian's apartment to demand an explanation. She had one hand on the doorknob when voices traveled from the door.

""Julian, that was brutal,"" Ryan Kincaid said, laughing sharply. ""You posted those photos, and Avery's finished. Her direct admission is gone. Let's see if she ever dares challenge Tessa again.""

Logan Hart chimed in, ""Come on! Julian has never liked Avery in the last two years and couldn't even stand to touch her. He sent his brother instead. Just imagine her face if she ever found out!""

The words detonated in Avery's head. She clapped a hand over her mouth to choke back the scream rising in her throat, and the color drained from her face.

Logan elbowed the man sitting beside Julian, who looked so much like him. ""Hey, Jace, you slept with your brother's girlfriend for two years. How's that feel? We're dying to know.""

Jace raised his glass, flashed a crooked grin, and said, ""What else? She's a knockout. She has smooth skin, the sweetest moan, and she lets me do whatever I want to her. Why do you think I'm transferring to Northbridge? It's so I can make out with her whenever I want.""

Julian finally spoke, his voice sounding cold and indifferent, with each word sharp as a blade. ""You've got a few days. Do what you want now. Once Tessa's admission is secured, I'll cut Avery off and ask Tessa to be my girlfriend.""

""Seriously? You're finally making a move on Tessa?"" Ryan whooped. ""You've been into her for years—spoiling her since you were kids. There's only one direct admission slot, and Tessa wanted it badly.

""As soon as you knew Avery was her biggest competition, you started dating Avery and worked out this scheme. Man, who could treat Tessa better than you?""

Every word hit Avery like a blow to the chest. She froze from the inside out. Even her blood felt cold.

So, this was the truth—vile and brutally cruel.

She couldn't stand there for another second. She turned and ran, stumbling down the stairs and into the alley until tears blurred the world.

Her parents were strict to the core, so she had never dated before Julian. She even believed romance was nothing but trouble and a waste of time.

That all changed freshman year, when she was crossing the outdoor courts with an armful of books and a basketball came flying at her face. She flinched, bracing for the hit, but it never came.

A tall, cool guy stepped in and caught the ball.

When she looked up, she met a pair of dark, indifferent eyes.

The setting sun cast gold across his shoulders, and sweat glistened at his temple. He looked carved rather than born, and her heart skipped off script in a way she couldn't explain.

Later, she learned his name—Julian Mercer, the heartthrob everyone at Northbridge admired.

He was born into wealth, and his family's name was stamped on several university buildings they had funded. He was obscenely handsome and coolly aloof about it.

Women across campus lined up to catch his eye, but he ignored them all except for Tessa Simpson, the rising star of the music department.

Avery knew from the start that she and Julian came from different worlds. So, she buried her crush and threw herself into her studies, taking first place in her year again and again.

Then, somehow, she kept running into Julian by coincidence. They crossed paths in the library, in lecture halls, and even in the cafeteria. He always seemed to be nearby.

One day, after cramming too hard, she dozed off at a study table. When she woke up, she found her head resting on Julian's shoulder.

She jerked upright, her cheeks burning, but he caught her wrist. ""Avery, do you want to be my girlfriend?"" he asked in a low voice.

Her mind went blank as a rush of joy flooded her, and she nodded almost dazedly.

Dating him felt ""strange"" from day one.

By day, he was distant, barely texting, and showing up for dates like he was checking a box.

But at night, he became someone else. Hungry, relentless, and always ready with his phone to snap pictures in bed.

The photos made her uneasy, but she brushed them all off. He had always been cool and aloof. He acted distant with her during the day because he was so busy. But at night, he couldn't hold back because he loved her.

She never imagined them to be actually two people. Julian spent the days with her, and Jace shared her bed at night.

To them, she was nothing more than a plaything and a tool for their own pleasure. All they really wanted was to strip away everything she had worked for and hand it to Tessa.

Avery stumbled into an empty alley and sank to the ground. Her tears slipped out in broken sobs that ached all the way to her bones.

Just then, her phone rang. It was her mother.

With trembling hands, Avery picked up.

Margaret Jones didn't waste a word and went straight into a shriek, ""Avery, what are those filthy photos on the campus forum? The Student Affairs office already called me. Do you have any idea how much shame you've brought on this family?""

Her father, Thomas Whitlock, growled in the background, ""We broke our backs for you, and this is how you repay us? You've disgraced us in front of the whole university! Shame on you!""

Avery couldn't get the words out. Her chest clenched until she couldn't breathe.

Her parents had always been exacting. The only time they ever smiled at her was when she took first place or came home with another award.

So, she studied like a machine, depriving herself of everything but excellence, hoping it might win a little more love from them.

Yet, in her worst moment, they offered no concern or trust—just scolding and contempt.

""You're always crying! Is that all you know? Your direct admission is gone! We've already bought you a ticket to Ardenia for the end of the month. You'll stay abroad for a few years until this is forgotten, and only then will you return,"" Margaret said coldly, leaving no room for refusal.

A chill seeped deep into her heart. 

""Okay,"" she replied numbly.

She would go to Ardenia, but she was never coming back.
Chapter 2
Avery hung up and returned to the apartment she shared with Julian, feeling like an empty shell.

She started packing without feeling a thing. She tossed every gift Julian had given her over the past year into the trash—necklaces, bracelets, stuffed animals, and lipstick.

Everything that once felt like proof of love now seemed like a cruel joke.

She was dropping the last necklace into the bin when the lock clicked.

Julian... No, Jace walked in.

He mimicked Julian's cool tone but softened it with a practiced warmth. ""Ave, what are you throwing away?""

Avery looked up with red and swollen eyes, glancing at the face which was so much like Julian's, only younger and more arrogant.

It felt like her chest had been ripped open from the inside. She was in so much pain that she could hardly breathe.

""You don't recognize any of it?"" she asked, her voice ragged and icy.

Jace's smile faltered for a beat, then he pivoted, sounding smooth as ever. ""Your eyes are swollen. Is it because of the photos on the forum? Don't be upset. I've handled it. The posts are gone, and no one's going to talk.

""So what if the direct admission's off the table? You're only a junior. You can try again next year, or just skip grad school. Come work at my company. I'll take care of you.""

The words cut straight through her. She dug her fingers into her palms.

Jace and Julian could win an acting award for their show.

Avery opened her mouth, but Jace was already folding her into his arms. He tucked his chin against her hair. ""Hey, don't cry. It kills me when you do, okay?""

The scent she knew so well closed in around her. His lips brushed her neck while his hands wandered over her body.

On any other night, she might've blushed and let herself be steered. But tonight, cold rolled through her, and her stomach turned.

She shoved him hard.

He was caught off guard. Surprise flashed in his eyes before he smoothed it away. ""What's wrong? Not in the mood?""

""I don't feel well,"" she said, turning her face aside.

He studied her for a few seconds, then gave a short laugh. ""Alright. I'll take a cold shower.""

He didn't force her. He turned and walked into the bathroom.

Avery kept packing and erased every trace of them she could find. When she was finished, she lay down on the bed and turned her back to the bathroom door.

A few minutes later, Jace came out damp and slid in beside her. He held still for a while, then he couldn't help himself. He curled in behind her and kissed the soft spot below her ear and the line of her shoulder.

She stiffened and endured it, drifting on the edge of sleep, until she heard him murmur in a low, muffled voice as he moved against her.

""Tessa...""

The single name hit like an ice pick. Avery snapped awake, a cold ache spreading through her chest.

So, it wasn't only Julian who loved Tessa. Jace had thought of Tessa every time he touched Avery.

She shoved him off again. Her teeth clicked together before the words came out. ""I told you. I don't feel well.""

Her fierce reaction actually shook him. He sensed something was wrong with her and finally let out a long sigh. ""Okay, okay. I won't force you. I'll just hold you, alright?""

He kept his word and only wrapped an arm around her from behind.

Avery lay stiff in the circle of his arm and cried into the pillow without a sound. Pain and disgust burned through her in waves until, sometime near dawn, sleep finally dragged her under.

When she woke, the other side of the bed was empty.

She used to wonder why Julian never walked to campus with her. Now, she had the answer.

He wasn't the one in her bed at night. He had never wanted to be close to her.

Avery got up numbly, washed up, and prepared to go to the university to complete her withdrawal.

She had barely crossed the quad when a student sprinted up and blocked her path. ""Avery! Thank god! Dr. Hale wants you in his office right now! He says it's urgent!""

A sinking feeling settled in her chest. Something bad was coming.

Avery reached the office door and knocked.

""Come in,"" Martin Hale said.

Avery stepped inside and saw Tessa already seated.

Tessa's eyes flickered with smug malice before she shifted her expression to appear fragile and wounded.

Martin's face was clouded over with anger. He slammed two printed theses onto his desk.

""Avery! Tessa! Explain this! Your papers are almost identical, right down to the typos! Academic misconduct is no small matter! Integrity comes first! If one of you copied, speak up now! The university will be more lenient if you're honest!""

Tessa cut in before Avery could speak, ""Dr. Hale, I wrote my paper myself! I don't know why it looks like Avery's, but I didn't plagiarize!""

Avery looked down at the pages and felt her heart sink, but she kept her voice steady. ""Dr. Hale, I wrote mine on my own. I didn't copy anyone.""

Martin pressed a hand to his temple. ""You both insist you didn't copy. So, where's the evidence?""

""I have a witness,"" Tessa said quickly.

Just then, the door opened again, and Julian walked in.",https://video.fpnh1-1.fna.fbcdn.net/o1/v/t2/f2/m412/AQMqs2lAeuXUlUvt4UZ7YZfAyggkeiKEJ8tKFKCGcy9-gbvJ-zgL2JpbeW4WsR5lIxLi4RXMlJvcKXTClAj93rVxdUgeSu4wvENKAsqkXw.mp4?_nc_cat=107&_nc_oc=AdpUwazpHe8b_FWFf985JDGLaUQLF44uIOHVrAQTdob5AVsac1PYd2BltpIZpHti114&_nc_sid=8bf8fe&_nc_ht=video.fpnh1-1.fna.fbcdn.net&_nc_ohc=c7MtS4CgCmcQ7kNvwH57T9A&efg=eyJ2ZW5jb2RlX3RhZyI6Inhwdl9wcm9ncmVzc2l2ZS5WSV9VU0VDQVNFX1BST0RVQ1RfVFlQRS4uQzMuMzYwLnN2ZV9zZCIsInhwdl9hc3NldF9pZCI6MTM2ODk1MDI0NDU3MTYyMCwiYXNzZXRfYWdlX2RheXMiOjE5MiwidmlfdXNlY2FzZV9pZCI6MTAxMzksImR1cmF0aW9uX3MiOjI2MiwidXJsZ2VuX3NvdXJjZSI6Ind3dyJ9&ccb=17-1&_nc_gid=noe3YVXvbiiqtnd7pN-IfA&_nc_ss=7f289&_nc_zt=28&oh=00_Af6tDTnHsHW0jEi46U5YT5qn0pMyGkQujyT2vy-o-tfY9A&oe=6A07E9CF
slot_machine,Inactive,1017137607280354,11 Jun 2025 - 23 Feb 2026,Apps4Free - Social Games,https://www.facebook.com/Apps4FreeSocialSlotsGames/,Yes,🎰 Play The Best SLOT-Machine GAMES!,https://scontent.fpnh1-1.fna.fbcdn.net/v/t39.35426-6/505228311_730972776285001_3212965695362986477_n.jpg?stp=dst-jpg_s600x600_tt6&_nc_cat=102&ccb=1-7&_nc_sid=c53f8f&_nc_ohc=DT9iE77VK6IQ7kNvwGe92hC&_nc_oc=AdqmXQrbBcNSpM58kzR1wIdsM6gP4pxS9y7R_ONfGMN9p4xjfWAPU_AbILfKtGzakI0&_nc_zt=14&_nc_ht=scontent.fpnh1-1.fna&_nc_gid=noe3YVXvbiiqtnd7pN-IfA&_nc_ss=7f289&oh=00_Af49XE2hXC0OTBZjtu6dSBTXS2ISRkCt_3uzIEttfaMWUg&oe=6A07E20B
slot_machine,Inactive,1725548581410839,17 Jul 2025 - 23 Feb 2026,Apps-4-Free,https://www.facebook.com/GameApps4Free/,Yes,🍀 The Best SLOT-Machine GAMES! 🍀,https://scontent.fpnh1-2.fna.fbcdn.net/v/t39.35426-6/518987176_1402658477662170_7619791238860728142_n.jpg?stp=dst-jpg_s600x600_tt6&_nc_cat=101&ccb=1-7&_nc_sid=c53f8f&_nc_ohc=7-h0C45rDeAQ7kNvwEpkNUQ&_nc_oc=AdoeOZve9TQk4v5lZ_kvDDtGLL_4-B_40vDKCms9IXnorNUG5cDDb8vl5HV6aUwCBw4&_nc_zt=14&_nc_ht=scontent.fpnh1-2.fna&_nc_gid=noe3YVXvbiiqtnd7pN-IfA&_nc_ss=7f289&oh=00_Af4CSTdYMI6ZBTFwo351sYkoy9Q-bXo2IiahYXzKjcVLCg&oe=6A07F03F
