keyword,status,library_id,date,page_name,page_link,sponsored,ad_text,media_url
slot_machine,Inactive,1564669028036356,31 Oct 2025 - 7 Nov 2025,Webfic- Make Reading Fantastic,https://www.facebook.com/61552616584831/,Yes,"Avery Whitlock was the ideal woman at Northbridge University that all the guys fantasized about.
However, her private photos were suddenly leaked onto the campus forum one day.

Her reputation was shredded overnight, and the university revoked her direct admission to the master's program. When she walked down the street, strangers jeered, ""How much for a night?""

There could only be one person who had those photos—her boyfriend, Julian Mercer.

Avery ran to Julian's apartment to demand an explanation. She had one hand on the doorknob when voices traveled from the door.

""Julian, that was brutal,"" Ryan Kincaid said, laughing sharply. ""You posted those photos, and Avery's finished. Her direct admission is gone. Let's see if she ever dares challenge Tessa again.""

Logan Hart chimed in, ""Come on! Julian has never liked Avery in the last two years and couldn't even stand to touch her. He sent his brother instead. Just imagine her face if she ever found out!""

The words detonated in Avery's head. She clapped a hand over her mouth to choke back the scream rising in her throat, and the color drained from her face.

Logan elbowed the man sitting beside Julian, who looked so much like him. ""Hey, Jace, you slept with your brother's girlfriend for two years. How's that feel? We're dying to know.""

Jace raised his glass, flashed a crooked grin, and said, ""What else? She's a knockout. She has smooth skin, the sweetest moan, and she lets me do whatever I want to her. Why do you think I'm transferring to Northbridge? It's so I can make out with her whenever I want.""

Julian finally spoke, his voice sounding cold and indifferent, with each word sharp as a blade. ""You've got a few days. Do what you want now. Once Tessa's admission is secured, I'll cut Avery off and ask Tessa to be my girlfriend.""

""Seriously? You're finally making a move on Tessa?"" Ryan whooped. ""You've been into her for years—spoiling her since you were kids. There's only one direct admission slot, and Tessa wanted it badly.

""As soon as you knew Avery was her biggest competition, you started dating Avery and worked out this scheme. Man, who could treat Tessa better than you?""

Every word hit Avery like a blow to the chest. She froze from the inside out. Even her blood felt cold.

So, this was the truth—vile and brutally cruel.

She couldn't stand there for another second. She turned and ran, stumbling down the stairs and into the alley until tears blurred the world.

Her parents were strict to the core, so she had never dated before Julian. She even believed romance was nothing but trouble and a waste of time.

That all changed freshman year, when she was crossing the outdoor courts with an armful of books and a basketball came flying at her face. She flinched, bracing for the hit, but it never came.

A tall, cool guy stepped in and caught the ball.

When she looked up, she met a pair of dark, indifferent eyes.

The setting sun cast gold across his shoulders, and sweat glistened at his temple. He looked carved rather than born, and her heart skipped off script in a way she couldn't explain.

Later, she learned his name—Julian Mercer, the heartthrob everyone at Northbridge admired.

He was born into wealth, and his family's name was stamped on several university buildings they had funded. He was obscenely handsome and coolly aloof about it.

Women across campus lined up to catch his eye, but he ignored them all except for Tessa Simpson, the rising star of the music department.

Avery knew from the start that she and Julian came from different worlds. So, she buried her crush and threw herself into her studies, taking first place in her year again and again.

Then, somehow, she kept running into Julian by coincidence. They crossed paths in the library, in lecture halls, and even in the cafeteria. He always seemed to be nearby.

One day, after cramming too hard, she dozed off at a study table. When she woke up, she found her head resting on Julian's shoulder.

She jerked upright, her cheeks burning, but he caught her wrist. ""Avery, do you want to be my girlfriend?"" he asked in a low voice.

Her mind went blank as a rush of joy flooded her, and she nodded almost dazedly.

Dating him felt ""strange"" from day one.

By day, he was distant, barely texting, and showing up for dates like he was checking a box.

But at night, he became someone else. Hungry, relentless, and always ready with his phone to snap pictures in bed.

The photos made her uneasy, but she brushed them all off. He had always been cool and aloof. He acted distant with her during the day because he was so busy. But at night, he couldn't hold back because he loved her.

She never imagined them to be actually two people. Julian spent the days with her, and Jace shared her bed at night.

To them, she was nothing more than a plaything and a tool for their own pleasure. All they really wanted was to strip away everything she had worked for and hand it to Tessa.

Avery stumbled into an empty alley and sank to the ground. Her tears slipped out in broken sobs that ached all the way to her bones.

Just then, her phone rang. It was her mother.

With trembling hands, Avery picked up.

Margaret Jones didn't waste a word and went straight into a shriek, ""Avery, what are those filthy photos on the campus forum? The Student Affairs office already called me. Do you have any idea how much shame you've brought on this family?""

Her father, Thomas Whitlock, growled in the background, ""We broke our backs for you, and this is how you repay us? You've disgraced us in front of the whole university! Shame on you!""

Avery couldn't get the words out. Her chest clenched until she couldn't breathe.

Her parents had always been exacting. The only time they ever smiled at her was when she took first place or came home with another award.

So, she studied like a machine, depriving herself of everything but excellence, hoping it might win a little more love from them.

Yet, in her worst moment, they offered no concern or trust—just scolding and contempt.

""You're always crying! Is that all you know? Your direct admission is gone! We've already bought you a ticket to Ardenia for the end of the month. You'll stay abroad for a few years until this is forgotten, and only then will you return,"" Margaret said coldly, leaving no room for refusal.

A chill seeped deep into her heart. 

""Okay,"" she replied numbly.

She would go to Ardenia, but she was never coming back.
Chapter 2
Avery hung up and returned to the apartment she shared with Julian, feeling like an empty shell.

She started packing without feeling a thing. She tossed every gift Julian had given her over the past year into the trash—necklaces, bracelets, stuffed animals, and lipstick.

Everything that once felt like proof of love now seemed like a cruel joke.

She was dropping the last necklace into the bin when the lock clicked.

Julian... No, Jace walked in.

He mimicked Julian's cool tone but softened it with a practiced warmth. ""Ave, what are you throwing away?""

Avery looked up with red and swollen eyes, glancing at the face which was so much like Julian's, only younger and more arrogant.

It felt like her chest had been ripped open from the inside. She was in so much pain that she could hardly breathe.

""You don't recognize any of it?"" she asked, her voice ragged and icy.

Jace's smile faltered for a beat, then he pivoted, sounding smooth as ever. ""Your eyes are swollen. Is it because of the photos on the forum? Don't be upset. I've handled it. The posts are gone, and no one's going to talk.

""So what if the direct admission's off the table? You're only a junior. You can try again next year, or just skip grad school. Come work at my company. I'll take care of you.""

The words cut straight through her. She dug her fingers into her palms.

Jace and Julian could win an acting award for their show.

Avery opened her mouth, but Jace was already folding her into his arms. He tucked his chin against her hair. ""Hey, don't cry. It kills me when you do, okay?""

The scent she knew so well closed in around her. His lips brushed her neck while his hands wandered over her body.

On any other night, she might've blushed and let herself be steered. But tonight, cold rolled through her, and her stomach turned.

She shoved him hard.

He was caught off guard. Surprise flashed in his eyes before he smoothed it away. ""What's wrong? Not in the mood?""

""I don't feel well,"" she said, turning her face aside.

He studied her for a few seconds, then gave a short laugh. ""Alright. I'll take a cold shower.""

He didn't force her. He turned and walked into the bathroom.

Avery kept packing and erased every trace of them she could find. When she was finished, she lay down on the bed and turned her back to the bathroom door.

A few minutes later, Jace came out damp and slid in beside her. He held still for a while, then he couldn't help himself. He curled in behind her and kissed the soft spot below her ear and the line of her shoulder.

She stiffened and endured it, drifting on the edge of sleep, until she heard him murmur in a low, muffled voice as he moved against her.

""Tessa...""

The single name hit like an ice pick. Avery snapped awake, a cold ache spreading through her chest.

So, it wasn't only Julian who loved Tessa. Jace had thought of Tessa every time he touched Avery.

She shoved him off again. Her teeth clicked together before the words came out. ""I told you. I don't feel well.""

Her fierce reaction actually shook him. He sensed something was wrong with her and finally let out a long sigh. ""Okay, okay. I won't force you. I'll just hold you, alright?""

He kept his word and only wrapped an arm around her from behind.

Avery lay stiff in the circle of his arm and cried into the pillow without a sound. Pain and disgust burned through her in waves until, sometime near dawn, sleep finally dragged her under.

When she woke, the other side of the bed was empty.

She used to wonder why Julian never walked to campus with her. Now, she had the answer.

He wasn't the one in her bed at night. He had never wanted to be close to her.

Avery got up numbly, washed up, and prepared to go to the university to complete her withdrawal.

She had barely crossed the quad when a student sprinted up and blocked her path. ""Avery! Thank god! Dr. Hale wants you in his office right now! He says it's urgent!""

A sinking feeling settled in her chest. Something bad was coming.

Avery reached the office door and knocked.

""Come in,"" Martin Hale said.

Avery stepped inside and saw Tessa already seated.

Tessa's eyes flickered with smug malice before she shifted her expression to appear fragile and wounded.

Martin's face was clouded over with anger. He slammed two printed theses onto his desk.

""Avery! Tessa! Explain this! Your papers are almost identical, right down to the typos! Academic misconduct is no small matter! Integrity comes first! If one of you copied, speak up now! The university will be more lenient if you're honest!""

Tessa cut in before Avery could speak, ""Dr. Hale, I wrote my paper myself! I don't know why it looks like Avery's, but I didn't plagiarize!""

Avery looked down at the pages and felt her heart sink, but she kept her voice steady. ""Dr. Hale, I wrote mine on my own. I didn't copy anyone.""

Martin pressed a hand to his temple. ""You both insist you didn't copy. So, where's the evidence?""

""I have a witness,"" Tessa said quickly.

Just then, the door opened again, and Julian walked in.",https://video.fpnh1-1.fna.fbcdn.net/o1/v/t2/f2/m412/AQNnnVhbg2flW40b4TIWNoOsFmXHAMLxz1jsAnKL2HNVM7_yxoq3YUZ-cHo7vgcut-atEsZkLaXUxfvumjRXTvYpAc1RvMQUWFA62_wS2Q.mp4?_nc_cat=102&_nc_oc=AdoOjS_JmLZ4FJyHgltmAVNKtn0fZ4dDu1BoV_W0EvPlh2vijHYs2IecdCqf8GPIUrY&_nc_sid=8bf8fe&_nc_ht=video.fpnh1-1.fna.fbcdn.net&_nc_ohc=W3jtZCKNsGsQ7kNvwG-D9J8&efg=eyJ2ZW5jb2RlX3RhZyI6Inhwdl9wcm9ncmVzc2l2ZS5WSV9VU0VDQVNFX1BST0RVQ1RfVFlQRS4uQzMuMzYwLnN2ZV9zZCIsInhwdl9hc3NldF9pZCI6MjA3Mzk1Njc5MzM0NTc1MSwiYXNzZXRfYWdlX2RheXMiOjE5MiwidmlfdXNlY2FzZV9pZCI6MTAxMzksImR1cmF0aW9uX3MiOjIwMSwidXJsZ2VuX3NvdXJjZSI6Ind3dyJ9&ccb=17-1&_nc_gid=MtQVX7BK6f83H8lMBhSCJw&_nc_ss=7f289&_nc_zt=28&oh=00_Af5Wz11W1Wu_QoQ0vGp3T0iOp0iDd3sqZQpHnHBsrbgs7g&oe=6A07E064
slot_machine,Inactive,1960114438055363,26 Sep 2025 - 8 Oct 2025,Tank Pack Attack,https://www.facebook.com/61579603290737/,Yes,,
slot_machine,Inactive,1503166697453934,10 Dec 2025 - 22 Dec 2025,Tank Pack Attack,https://www.facebook.com/61579603290737/,Yes,Can You Create the ULTIMATE Weapon?,https://video.fpnh1-1.fna.fbcdn.net/o1/v/t2/f2/m412/AQNHKOEQOeGbwb_Lbf8d-IgW79g8tWjKM8QY6cu8h-8R6cy9Mc3kFPWC_lQfykiXvSWkgUm0ReOVfs7eBkC_UI-JXauzP8Bv29lDrHze1g.mp4?_nc_cat=100&_nc_oc=AdpCBRgucCsyHZs2roN9pLWy0XdHlngZip047LMtrVT3p6PdMsUuvXtZsIRRrWG08kI&_nc_sid=8bf8fe&_nc_ht=video.fpnh1-1.fna.fbcdn.net&_nc_ohc=vux0PbGftOAQ7kNvwGvCbR2&efg=eyJ2ZW5jb2RlX3RhZyI6Inhwdl9wcm9ncmVzc2l2ZS5WSV9VU0VDQVNFX1BST0RVQ1RfVFlQRS4uQzMuMzYwLnN2ZV9zZCIsInhwdl9hc3NldF9pZCI6ODQ1ODEwMzE1MDM3MTI2LCJhc3NldF9hZ2VfZGF5cyI6MTUyLCJ2aV91c2VjYXNlX2lkIjoxMDc5OSwiZHVyYXRpb25fcyI6NDAsInVybGdlbl9zb3VyY2UiOiJ3d3cifQ%3D%3D&ccb=17-1&_nc_gid=MtQVX7BK6f83H8lMBhSCJw&_nc_ss=7f289&_nc_zt=28&oh=00_Af7sIAOkkCnP-2hr1EFJ3hYgvaSywRZ5x_UAPkq68zIlMg&oe=6A07F2FE
slot_machine,Inactive,1621749165937498,9 Feb 2026 - 13 Mar 2026,"Cangzhou Terok International Trade Co., Ltd.",https://www.facebook.com/61578855814440/,Yes,"⚙️ Conveyor Rollers & Components – China Factory Direct
Cangzhou Terok manufactures conveyor rollers, bearing housings, steel pipes & seals with stable quality and custom solutions.
🏭 Factory direct supply from China — no middleman, no price gap.
🤝 We are seeking distributors worldwide.
📩 Contact Cangzhou Terok  now!",https://scontent.fpnh1-2.fna.fbcdn.net/v/t39.35426-6/638874941_2720446644978137_5421374092923569303_n.jpg?stp=dst-jpg_s600x600_tt6&_nc_cat=108&ccb=1-7&_nc_sid=c53f8f&_nc_ohc=7JM1vqg7vwoQ7kNvwGedCh2&_nc_oc=Ador6E3FlfgB93Lfmw0Y4jsHUFNZOopStUiLu-Pjq0ng-ZUkGF_YSD-kn1e7pHjc0zk&_nc_zt=14&_nc_ht=scontent.fpnh1-2.fna&_nc_gid=MtQVX7BK6f83H8lMBhSCJw&_nc_ss=7f289&oh=00_Af44xyyq_L2UrCUEyp0YU6ti_vXzhaXepUflvXcOs2QJzQ&oe=6A07C827
