keyword,status,library_id,date,page_name,page_link,sponsored,ad_text,media_url
slot_machine,Inactive,2083221295791608,3 Apr 2026 - 8 Apr 2026,Love Romance,https://www.facebook.com/61580176653856/,Yes,"In four years of marriage, this was the first time Adrian Lancaster hadn't used protection.

Wren Sutton noticed it the instant he entered her—raw, bare, nothing between them. Her breath caught, fingers twisting into the sheets.

Every single time before this, without exception, he had used a condom. She'd stopped asking why after the first year. The answer had always been written on his face: he didn't want anything permanent tying him to her.

But tonight was different.

He'd come home with liquor on his breath and something restless behind his eyes. She hadn't even finished blow-drying her hair before he was behind her—hands gripping her waist, mouth dragging hot and open down the curve of her neck.

""Adrian, my hair's still—""

He didn't let her finish.

He lifted her off the vanity stool and carried her to the bed, kissing her hard enough to bruise. His tongue swept past her lips, swallowing whatever protest she'd been forming. One hand found the neckline of her wine-red silk slip and pulled. The fabric tore with a whisper.

Cool air hit her bare chest. She gasped.

He drew back just enough to look—flushed skin, dark hair fanned across white sheets, the swell of her breasts rising and falling with each uneven breath. His jaw tightened. His Adam's apple dipped.

Then his mouth was on her, trailing from her collarbone downward. Teeth grazed. Tongue tasted. He closed his lips around one stiffened peak and sucked—slow, deliberate, almost punishing.

""Ah—""

Her back arched off the mattress. She pressed her thighs together on instinct, but he was already between them, one knee pushing them apart. His hand slid down her stomach, fingers hooking the edge of her underwear and dragging it down with no ceremony.

She was already wet. Embarrassingly, helplessly wet—and he'd barely touched her.

That was the cruelest thing about Adrian Lancaster. He was ice everywhere else—but in bed, he made her body betray every ounce of dignity she had. She hated how much she craved it. Hated that this was the only place he ever made her feel wanted.

His fingers found her first. Two of them, sliding in with practiced ease, curling against the spot that made her vision swim.

""Oh god—Adrian—""

He watched her face while he worked her open. No tenderness in his expression. Just focus. Precision. Like he was mapping which angle made her clench tighter, which rhythm made her moan louder.

Not once did he call her name.

He never did.

When he finally replaced his hand with himself, the stretch made her cry out. Without latex between them, every sensation was magnified—the heat of him, the friction, the way she could feel every ridge and pulse.

He groaned low against her ear. A rare, unguarded sound that sent electricity down her spine.

His pace was relentless. He gripped her hip with one hand and the headboard with the other, driving into her so deep her vision whited out. The bed frame cracked rhythmically against the wall.

""Too—too much—"" she whimpered, but her legs locked tighter around his waist, pulling him in. Her nails scored down his back, leaving raised red lines on his skin.

He grabbed both her wrists and pinned them above her head with one hand. His hips didn't slow.

""Take it."" Low. Commanding. The only two words he'd spoken since they started.

She shattered. The orgasm tore through her—white-hot, blinding—her inner walls clamping down on him in waves. He followed seconds later, burying himself to the hilt with a guttural groan, spilling inside her for the first time in their entire marriage.

For a moment, neither moved.

Wren lay trembling beneath him, sweat-dampened hair clinging to her temples. She could feel him still inside her, softening slowly. Could feel the warmth of what he'd left behind.

She placed a hand on her lower stomach and let herself smile.

He finally wants a child with me.

The bathroom faucet turned on. Then off.

Adrian emerged wrapped in a towel, not a trace of the man who'd groaned against her neck minutes ago. His face was blank. His eyes were cold. Like someone had flipped a switch and the man who'd just been inside her had ceased to exist.

He walked into the closet and came back in a tailored charcoal suit, adjusting his cufflinks with mechanical precision. The sharp click of his leather shoes on marble sounded like a countdown.

Wren forced herself upright, wincing. The ache between her thighs was sharp—he'd been rougher tonight than usual. Much rougher. The sheet pooled at her waist, leaving her bare from the chest up, his mouth's work still blooming in red marks across her skin.

""You're going out? It's nearly midnight.""

Adrian picked up his watch from the nightstand. He didn't look at her.

""Maya's back. She's not feeling well. I told her I'd be there tonight.""

The words landed like a blade dropping.

Wren's smile died on her lips.

Maya Marshall. Adrian's first love. His white moonlight. The woman who had left the country four years ago—who had rejected his airport proposal, a pigeon-egg diamond, a man on his knees—and still owned every chamber of his heart.

The woman he had never, in four years of marriage to someone else, stopped loving.

""Adrian.""

He was already at the door.

""Whatever it is,"" he said, not turning around, ""it can wait until tomorrow.""

""Don't go."" She hated how small her voice sounded. How desperate. ""Today is our wedding anniversary. Four years.""

He paused. Not out of hesitation—out of annoyance.

""It's a meaningless anniversary, Wren.""

The words hit her sternum like a fist.

She forced herself to keep going, even as her throat closed. ""You and Maya broke up four years ago. I'm your wife. You can't leave our bed to go to her.""

Adrian glanced back. His gaze swept over her—bare shoulders, swollen lips, the lovebites he'd left on her throat twenty minutes ago—and there was nothing in his eyes. No guilt. No conflict. Not even the faintest shadow of the desire that had consumed him moments earlier.

""Don't wait up.""

The door closed behind him.

Wren sat frozen in the bed that still smelled of sex and him, still feeling the ache he'd left inside her body, and listened to his footsteps recede down the hallway until there was nothing left but silence.

She didn't cry. Not yet.

She pulled the sheet up to her chest and stared at the closed door.

He didn't call my name. Not once. Not the entire time.

She didn't know how long she sat there before the familiar chime of a notification broke the silence.

2:14 AM — Trending Now: [Lancaster heir spotted on late-night rendezvous with rumored first love—are they back together?]

The photo showed Adrian outside a hotel, holding an umbrella over Maya Marshall. She was tucked against his chest, fragile and perfect. His left shoulder was soaked through with rain, but he didn't seem to notice or care. He was looking down at her with an expression Wren had never once—not once in four years—seen directed at herself.

Tenderness. Pure, unguarded tenderness.

So that's what it looks like, she thought numbly, when he actually loves someone.

She should have closed the app. She didn't.

She scrolled through four years of Maya's social media instead. Every holiday Wren had spent alone, Maya had documented with Adrian by her side. Christmas in Vienna. New Year's in Tokyo. Valentine's Day in Paris. He'd flown halfway around the world, repeatedly, while his own wife sat in their empty penthouse eating takeout on her birthday, pretending it didn't matter.

In every photo, he looked at Maya the way men look at women in movies—like she was the only person in the frame.

Wren didn't have a single photo with him. Not one. Their marriage certificate picture was it—where he'd faced the camera with the enthusiasm of a man at the DMV.

DING.

A text from an unknown number.

She opened it, and the floor dropped out from under her.

It was a photo of a medical report. A pregnancy test.

Patient Name: Maya Marshall Result: Positive (6 weeks)

Below the image, one line of text:

[This is Adrian's baby. You can keep the ring. I'll take the man.]

Wren read it three times.

Six weeks.

Maya had been pregnant for six weeks. Which meant Adrian had been sleeping with her well before she returned to the country. Which meant every business trip, every ""emergency"" that called him away—

Wren looked down at her own body. At the finger-shaped bruises darkening on her hips. At the rawness still throbbing between her thighs.

The realization hit her like ice water.

He didn't skip the condom because he wanted a baby with me.

He skipped it because he couldn't bear to be rough with Maya—not while she's carrying his child. He needed an outlet. A body he could use without worrying about consequences.

That's all I am. That's all I've ever been.

She pressed her palm against her mouth to hold the sound in.

It didn't work.

The sob came anyway—ugly, heaving, the kind that cracked her ribs. She curled into the sheets that reeked of him, of sex, of the cruel illusion of intimacy, and cried until her throat was raw.

""Adrian Lancaster,"" she whispered into the dark, ""you absolute bastard.""

Four years. Four years of convincing herself that patience and devotion could melt even the coldest heart. That one day he'd look at her the way he looked at Maya—just once—and it would all have been worth it.

What a joke.

She pressed her face into the pillow and screamed until she had nothing left.

Then she lay still.

The tears dried. Her breathing evened out. And something behind her eyes shifted—quietly, irreversibly—like a door swinging shut on rusted hinges.

I'm done.

...

Chapter 2: The Divorce Plan
The next morning, Wren called her office and took a half-day.

Her legs could barely carry her to the kitchen. Every step was a reminder—not of pleasure, but of how thoroughly she'd been used and discarded. She made herself tea and sat at the dining table, staring at her phone.

No calls from Adrian. No texts. Nothing.

Around noon, the pain started.

It began as a dull ache in her lower abdomen—easy to dismiss as cramps, maybe her period coming early. But within an hour, it sharpened into something vicious, a hot wire being pulled taut through her pelvis.

Then the bleeding.

Wren looked down and saw red soaking through her pajama shorts. Not spotting. Bright, arterial red, spreading fast.

This isn't normal.

Her hands trembled as she grabbed her phone and dialed 911.

The paramedics found her on the bathroom floor, ashen-faced, drenched in cold sweat. At the hospital, the diagnosis came quickly: ruptured corpus luteum. Emergency surgery required.

""Mrs. Lancaster,"" the surgeon said, his expression grave, ""the rupture was likely triggered by intense physical strain. Given the severity, there's a risk this procedure could affect your future fertility. We need a family member's signature before we can proceed.""

Intense physical strain.

Wren thought of last night. Adrian's hands on her hips, the force of him, the way he'd pinned her wrists and told her to take it. Her body had been screaming even then—she'd just mistaken the pain for passion.

He did this to her. And he wasn't even here.

Her fingers were ice-cold as she dialed his number. It rang twice.

""What is it?"" Flat. Impatient. In the background, the faint clinking of porcelain—breakfast, maybe. Somewhere comfortable. Somewhere that wasn't a hospital.

""I'm at the hospital. I need emergency surgery. They need your signature.""

A pause. Then:

""I mentioned last night that Maya wasn't feeling well, and today you suddenly need surgery. Isn't that a little too convenient?""

Wren's vision blurred. Her heart felt like it was being wrung out.

He didn't believe her. He never questioned a single word Maya Marshall said—but his own wife's medical emergency was a performance to him.

She thought of their wedding day. The ceremony half-finished when his phone rang. Maya had said she had a headache, and Adrian had abandoned Wren at the altar, in front of everyone, and flown abroad that same night. He never apologized. Never explained.

The line between love and its absence had always been painfully clear. She was the fool who'd spent four years pretending she couldn't see it.

""I'm not lying to you. I'm really at the hospital, Adrian.""

His voice dripped with derision. ""If you're going to cause a scene, come up with a better excuse. Cursing yourself with a hospital story—you must have a death wish.""

Wren stared at the fluorescent lights on the pre-op ceiling, tears sliding silently into her hair. ""Adrian Lancaster, if you don't come today, you might never see me again.""

Before he could respond, she heard it—Maya's voice, light and sweet, floating through the phone like wind chimes.

""Adrian, the cake's ready. Come try some.""

""Alright.""

He hung up without a second of hesitation.

BEEP. BEEP. BEEP.

Wren lowered the phone from her ear and closed her eyes.

Adrian would rather eat cake with Maya Marshall than come to a hospital where his wife might be dying. He didn't care if she lived or if she didn't.

Something inside her chest clicked shut. Quietly. Permanently.

She opened her eyes and looked at the surgeon.

""Doctor, I'll sign for myself. I accept all risks. Let's proceed.""

The surgeon hesitated, clearly uncomfortable. But he'd seen enough of life's cruelties to recognize a woman who had no one else to call. He sighed.

""Prepare for surgery.""

The surgery lasted two hours. It was a success.

When Wren drifted back to consciousness, the anesthesia was still clouding her senses. She slept for another hour in the recovery room before the sharp smell of disinfectant finally pulled her fully awake.

A nurse was changing her IV bag.

""You're up! The surgery went perfectly. The department head said you're in excellent health—it won't affect your ability to have children in the future.""

A wave of complicated emotions surged through Wren's chest, but the heaviest knot loosened.

Thank God. At least He hadn't taken away her chance to become a mother. Even if the man who should have been by her side had chosen cake over her life.

""You just rest. I've taken care of the admission paperwork,"" the nurse said warmly. ""The department head says you'll need to stay at least a week.""

""Thank you.""

The nurse closed the door softly. The room fell quiet. Late-afternoon sunlight slanted through the window, gilding the sill in amber.

Wren checked her phone. More than a dozen missed calls from the office. And a string of messages from the chief secretary:

""Unexcused absence this afternoon. What's going on?""

""Your pay for today will be docked.""

""You're not answering your phone or replying to messages. Wren Sutton, are you trying to start a rebellion?""

""The Group doesn't pay slackers. Provide a reasonable explanation by six, or don't bother showing up tomorrow.""

Wren set her phone down. Her heart was strangely calm.

She wasn't just Adrian Lancaster's wife. She was also a secretary in the Lancaster Group's secretarial department—the lowest rung.

Aside from Kevin Dawson, the CEO's executive assistant, no one at the company knew she was Mrs. Lancaster. To the chief secretary, she was just another junior employee to bully.

Wren was meticulous at her job. She'd never once made an error. But her looks—her face, her figure—had made her a target from day one. The chief secretary picked at her constantly. The other secretaries froze her out. She endured it all in silence, year after year, because she was Adrian's wife and didn't want to cause him trouble.

What was the point?

She was giving up on Adrian Lancaster. She didn't need his company's paycheck, and she certainly didn't need to swallow abuse from women who'd be tripping over themselves to apologize if they knew who she really was.

Whoever wants that job can have it.

Wren spent the next several days recovering alone in the hospital, with a hired caregiver to help her.

Her parents were aging and not in good health. She couldn't bear to worry them.

Adrian didn't call. Not once. She didn't expect him to.

From the company group chat—which she still hadn't left—she learned that Adrian was away on a business trip. Due back either today or tomorrow.

Coincidentally, Maya Marshall had been active on social media all week. No photos of Adrian directly, but every post dripped with implication—a man's suit jacket draped over a chair, two wine glasses on a balcony, and a caption that read: ""Made coffee. Waiting for him.""

A week ago, Wren would have been gutted. Now she scrolled past it the way you'd scroll past a weather alert for a city you no longer lived in.

She was too busy browsing real estate listings.

After comparing several properties, she settled on a large, beautifully furnished flat in Amberwood Estates. The price was steep, but the interior was stunning—modern, full of light, move-in ready. A home that looked nothing like the cold Lancaster villa with its empty rooms and emptier marriage.

She was mid-conversation with the real estate agent when her phone rang.

Isla Griffith. Her best friend. Her only real friend.

Wren answered with a smile she hadn't felt in days. ""Well, well. If it isn't the famous actress, finally taking a break.""

""I just flew back from Starlight Studios. These past two weeks nearly killed me,"" Isla groaned. ""I'll be near your office in a bit. Lunch?""

""I'm not at the office.""

""Home?""

""Nope.""

""Then where? Send me the address. I'll come to you.""

Wren hesitated a beat. ""I'm at the hospital.""

Isla Griffith burst into the hospital room like a tornado with designer heels.

""That bastard Adrian Lancaster! It's not like he's some inexperienced teenager—why was he so goddamn rough?! He's the one who put you in this state, so where the hell is he? Why isn't he here?""

Wren gestured to the chair beside her bed. ""Sit. Calm down. I've already made up my mind. I don't need him here.""

Isla froze. ""What do you mean?""

""I'm going to divorce him.""

Isla stared.

Wren met her gaze, steady and clear-eyed. ""Maya Marshall is back. In four years, Adrian has never once truly cared about me. I've been left out in the cold for the entire marriage. I'm not going to suffer through it any longer.""

Isla's eyes went red. For a moment, she couldn't speak. Then she sat on the edge of the bed and pulled Wren into a fierce hug.

""Good,"" she whispered. ""Good. Leave that scumbag. With what you've got—your brains, your face, your heart—you'll have men lining up.""

Wren returned the hug, letting herself lean on someone for the first time in a week. ""I know I'll find a man who actually loves me.""

Isla pulled back, fire rekindling in her eyes. She launched into a blistering tirade—creatively, colorfully, and at impressive length—against both Adrian Lancaster and Maya Marshall. The caregiver in the corner pretended to be very interested in the wall.

""Adrian is the one at fault here,"" Isla said, jabbing a finger in the air. ""You can't let him walk away clean. The divorce settlement needs to hurt.""

""I've already picked out an apartment. At least I'll have somewhere to go after."" Wren paused, then leaned in and lowered her voice. ""But the apartment isn't the real plan. Here's what I'm actually going to do—""

She whispered the rest into Isla's ear.

Isla's eyes widened, then lit up like fireworks. She pulled back and gave Wren a massive thumbs-up.

""Wren Sutton, you magnificent woman.""

...

Chapter 3: I'm Done Serving
The Lancaster Group headquarters.

A misplaced decimal point in a contract had cost the company over six million dollars.

Adrian Lancaster was livid.

He stood behind his desk, the offending document crumpled in his fist, his voice cold enough to freeze the room. ""This was an obvious error. How the hell did it go uncaught?""

The chief secretary stood before him, visibly trembling. ""President Lancaster, I'm deeply sorry. It was an oversight—""

""Who proofread this contract?""

The chief secretary didn't hesitate. ""Wren Sutton.""

The name hit different today. Adrian's eyes narrowed. Of course. Wren hadn't been at the office in days—hadn't called, hadn't texted, hadn't shown the slightest interest in whether he was alive or dead. And now a contract she supposedly proofread was bleeding the company dry.

He was convinced she'd done it deliberately. He hadn't come home, so she was retaliating through his business. He'd underestimated her.

""Get her in here.""

""President Lancaster… Wren Sutton hasn't come into the office for several days. She isn't answering calls or messages.""

""Who approved her leave?""

""No one. It's an unexcused absence.""

Adrian's jaw clenched. He rose, grabbed his coat, and strode toward the door.

""President Lancaster, where are you going—""

""Out.""

He drove home at twice the legal speed.

The villa was dark. Silent. He threw the front door open and tossed his car keys onto the entry table with a clatter.

""Wren, get down here.""

Nothing.

""Don't pretend you're asleep. Get down here. We need to talk.""

Silence.

Adrian's expression hardened. He took the stairs two at a time and shoved open the bedroom door.

Empty. The bed was made with hotel-room precision. The vanity was bare—no half-finished glass of water, no hairbrush left out. Even the faint scent of her perfume that usually clung to the pillows was gone.

Wren wasn't here. Hadn't been here in days.

For reasons he refused to examine, the emptiness of the room hit him harder than the six-million-dollar loss.

He loosened his tie with a rough jerk and called her.

It rang five times before she answered.

""Wren Sutton. I don't care where you are. Come home. Now.""

On the other end, Wren almost laughed.

Pigs must be flying. But she caught herself. She couldn't show her hand—not yet. Not until everything was in place.

""I'll be back in a few days. My best friend just got back from a shoot. I'm staying with her for a bit.""

Adrian didn't question it. But his frown deepened. ""If you're at her place, who's going to cook for me?""

""Order takeout.""

""I don't eat that junk.""

Then starve, Wren thought. He never thinks of me until his stomach growls. For years she'd been a workhorse at his company by day and a maid in his house by night. Adrian refused to hire household help—didn't like ""strangers in his space""—so every chore, from laundry to cooking to scrubbing floors, fell on her shoulders alone. In return, she got no romance, no affection, no gratitude. Just an endless list of tasks and a husband who looked through her like glass.

She was done serving.

""If takeout is beneath you, go eat at the family estate.""

""What would that look like? Going back to eat alone? What would the elders think?""

How did I never notice how insufferable he is? He shot down every suggestion about a simple meal. As if feeding himself was beneath his dignity.

""Are you listening to me?"" Adrian demanded from the sofa, his face dark with frustration.

Wren closed her eyes and resisted the urge to say something she couldn't take back.

""You won't eat takeout. You won't go to the estate. So what exactly do you want, Adrian?""

""Come back, cook dinner, and leave when you're done,"" he said, as if this were a perfectly reasonable request—as if he were being generous by allowing her to return to her friend afterward.

Wren was stunned. The sheer depth of his selfishness had found a new floor.

""How dare you even suggest that?""

Adrian's expression didn't change. Zero guilt. ""The company lost over six million because of your negligence. You want to talk about nerve?""

Wren's blood went cold.

What contract?

""I have never made a mistake at work. I haven't proofread a single contract in the past month. If there's an error that caused a loss, it wasn't mine.""

""Talk is cheap.""

""Adrian. I'm telling you the truth. Check the proofreading logs. My name won't be on them.""

""And why should I believe you?""

Five words. That was all it took.

Five words, and four years of devotion collapsed into rubble.

She'd given him everything—her time, her labor, her youth, her dignity—and he wouldn't even grant her the basic trust of checking a work record before condemning her.

Her hand tightened around the phone. Then, slowly, deliberately, she unclenched it.

""If you're determined to blame me,"" she said quietly, ""you'll always find a reason. In that case, Adrian, there's nothing left for us to talk about.""

""What's that supposed to mean?"" Something in her tone made him sit up straighter.

""It means I'll come home when I feel like it, and I won't when I don't. I wouldn't cook for you if you were starving to death. Find someone else to be your maid.""

""Wren Sutton—""

""Adrian Lancaster, I was blind. Utterly deluded. If I could turn back time, I would have stayed as far away from you as humanly possible.""

She hung up.

BEEP. BEEP. BEEP.

Adrian stared at the phone in his hand. His knuckles were white.

She hung up on me.

She'd never—not once in four years—hung up on him. She'd never raised her voice, never refused a request, never pushed back on anything. And now she was telling him to starve?

So she's grown some backbone.

His jaw worked. A dangerous darkness gathered in his eyes.

Fine. Let her play her little game. When she finally dragged herself back to the office, he would settle every score—old and new.

If murder weren't illegal, Wren thought as she set her phone down, Adrian Lancaster would be my first victim.

He'd blamed her for a mistake she didn't make, without a shred of investigation, and had the audacity to sound righteous about it. Did he truly think she was that much of a pushover?

She'd been that pushover for four years. Not anymore.

You want to accuse me of costing you six million? Fine. I'll spend twice that.

She contacted the real estate agent and upgraded her selection—a larger flat, higher floor, more luxurious finishes. Full cash purchase.

After their marriage, Adrian had given Wren a black card. To let her ""spend freely,"" he'd unlinked it from his personal banking alerts, so her purchases wouldn't trigger notifications on his phone. A generous gesture in theory—but in practice, it was hush money. He gave Maya Marshall his time, his body, his tenderness. He gave Wren a credit card and silence.

And Wren, fool that she was, had barely used it. She didn't want to be seen as a gold digger. She felt guilty spending his money, because she knew how hard he worked.

God, I was stupid.

The card wasn't love. It was a transaction. Payment for services rendered—cooking, cleaning, warming his bed, and keeping her mouth shut.

Well, if he was going to treat this marriage like a business arrangement, she'd collect what she was owed.

If you can't capture a man's heart, capture his wallet.

With Wren gone, Adrian found the villa unbearable.

Everything irritated him. The kitchen was spotless but cold—no smell of food, no warmth. He couldn't find the coffee filters. He opened the wrong drawer three times looking for a bottle opener and realized he didn't actually know where anything in his own kitchen was kept.

Because Wren had always handled it. All of it.

The house felt less like a home and more like an exhibit—pristine, silent, and lifeless.

He smoked through half a pack, but the restlessness didn't subside.

What the hell is wrong with me? he thought. So she's not home. Why should I care? She can go wherever she wants. If she's got the guts, she should never come back.

He grabbed his keys and left.

The lights in the president's office had been burning past midnight all week. As long as Adrian Lancaster was in the building, no one in the secretarial department dared leave.

Voices in the break room dropped to whispers:

""President Lancaster's been in a terrible mood.""

""It's the contract thing. Six million. He's furious.""

""It's all Wren Sutton's fault.""

The secretaries exchanged practiced looks—the kind shared by people who all knew the agreed-upon story.

""Exactly. One bad apple.""

""She hasn't shown up in days. If that's not an admission of guilt, I don't know what is.""

""If they investigate, she'll probably get fired.""

""Fired? If I were the boss, she'd be in court.""

One of them lowered her voice, glancing toward the hallway. ""I never liked her anyway. Always using her looks to get ahead—constantly going into President Lancaster's office. I saw her come out once with her blouse buttoned wrong and lipstick smudged.""

""Disgusting. Trying to seduce the president when everyone knows he has a girlfriend.""

The break room door swung open.

Adrian Lancaster walked past without a glance, heading for the elevator. His face was carved from granite. The secretaries scattered like mice, scrambling back to their desks with their heads down, not daring to breathe.

He hadn't heard them. His mind was somewhere else entirely.

...

Chapter 4: The Mouth Is The Toughest Part
In the top-floor suite of a private club, Adrian sat in the center of a black leather sofa, drinking in silence. His expression could have frozen the whiskey in his glass.

Caleb Caldwell and Sean Sterling, seated across from him, exchanged a look. Something was wrong—more wrong than usual.

The mood was nearly identical to the night Maya Marshall had left the country four years ago.

""What's going on?"" Sean Sterling broke the silence, adjusting his gold-rimmed glasses. A flicker of concern crossed his usually composed face.

He was two years Adrian's senior—not just a close friend, but a cousin.

Adrian pretended not to hear. He poured another glass and threw it back.

""Adrian, drinking like that is going to wreck your body."" Caleb, the youngest of the three, was also the most reckless. ""If something's eating you, just say it. Drowning it only makes it worse.""

He was bold enough to reach out and snatch the glass from Adrian's hand.

Adrian fixed him with a stare that could have stopped a man's heart. ""Put the glass down.""

""I'm doing this for your—""

""That plot of land in Southgate. Do you still want it or not?""

Caleb's face crumbled. He looked to Sean for backup.

""Sean, help. He's got me by the throat.""

Sean pinched the bridge of his nose. He knew Adrian's temper intimately: cold, vicious, and immovable. Once provoked, he'd turn on his own shadow. Hadn't changed since they were children.

""The Southgate land is more important. Give him the glass. Let him drink. He'll stop when he's done.""

Caleb sighed in defeat and handed it back.

But Adrian wasn't satisfied. ""So in your eyes, I'm worth less than a plot of land?""

Sean leaned back, watching him with the patience of a man who'd done this many times before. ""If we try to stop you, you bite our heads off. If we don't, you complain we don't care. With a personality like yours, even your own parents can barely stand you. Frankly, in this world, only Wren has the patience to put up with you.""

The name hit a nerve.

Adrian's face darkened instantly. ""Don't mention her.""

He poured a fresh glass and drained it in one go.

Sean raised an eyebrow. Caleb's eyes darted between them. The picture was becoming clear.

""Adrian… did you and Wren have a fight?""

""No.""

""If you didn't fight, where's all this rage coming from?""

""If your company lost six million, you'd be angry too.""

Caleb blinked. ""Honestly? I wouldn't. It's business. You lose money on one deal, you make it back on the next.""

Adrian's fist tightened. ""Caleb Caldwell, don't make me hit you.""

""I'm just being—""

""Enough,"" Sean cut in. He glanced at his watch and uncrossed his legs. ""It's late. Since you two didn't fight, I'll call Wren and have her come pick you up.""

Adrian's glass stopped halfway to his lips. ""No need.""

Sean was already pulling out his phone. ""Caleb and I both have things to do. We can't babysit. If your wife picks you up, everyone can relax.""

""She was… already asleep when I left."" The excuse sounded thin even to his own ears.

""Wren's always been understanding. If she knows you've been drinking, she'll come.""

A week ago, Adrian would have believed that without question. Tonight, he wasn't sure.

Everyone called him stubborn, but wasn't Wren just as bad? She wouldn't admit when she was wrong, she'd hung up on him, and she hadn't called once during his entire business trip. He'd come home to a dark, empty house.

""I have a driver. I don't need her.""

Sean held up his phone, screen facing Adrian. ""Already dialing.""

Wren's name glowed on the display. Speakerphone. Too late to stop it.

""You—""

Adrian clenched his jaw and looked away. But his ears sharpened. Something inside his chest pulled taut with an anticipation he refused to name.

If she comes, he told himself, I'll let it go. All of it. I'll act like nothing happened.

The six million meant nothing to him. What stung was her attitude—her coldness—the way she'd spoken to him like he was a stranger.

Would it kill her to soften up? To just admit she was wrong?

The phone rang. And rang. And rang.

Silence.

A hollow feeling opened in Adrian's chest.

Sean gave a wry smile. ""Seems like she really is—""

The call connected.

""Sean?"" Wren's voice was soft, drowsy, slightly husky from sleep. In the quiet of the private room, it sounded almost intimate—like a woman murmuring to the pillow beside her. ""Is that you?""

Adrian's expression soured instantly.

Sean, recognizing he'd woken her, softened his voice. ""It's me. Sorry to call so late. Did I wake you?""

""It's fine. What's going on?""

""Adrian's had a bit much to drink. If it's convenient, could you come pick him up? The usual place.""

A pause.

Then, with perfect composure: ""Sorry, Sean. It's not convenient for me right now.""

Another pause. And then:

""I'm sure Maya Marshall would be happy to pick up Adrian. You should call her.""

The air in the room solidified.

Caleb's drink stopped halfway to his mouth.

Sean blinked.

They both turned, involuntarily, to look at Adrian—whose face was cycling through expressions like a slot machine that had broken.

Wren Sutton. His jaw locked so hard his molars ached. How dare you.

""Sean, if there's nothing else, I'm going to hang up,"" Wren said pleasantly. As if she'd just declined a dinner invitation.

Sean recovered first. So they did fight, he thought. And Maya Marshall is at the center of it. As usual.

""Of course. I'll arrange a driver to take him home. Get some rest, Wren.""

The line went dead.

From start to finish, Adrian Lancaster hadn't gotten a single word in.

Caleb slowly set down his glass and pressed his lips together. Now is not the time to speak. If I open my mouth, I will lose that land in Southgate.

Sean stood, straightening his jacket. ""Since your wife isn't coming, I'll drive you home.""

Adrian's pride was in shreds, and he was drowning it in fury. ""No need.""

""What, you actually want Maya Marshall to come?""

""And why the hell not?"" The words came out before he could stop them. If Wren wouldn't come, plenty of women would. She wasn't the only woman in the world.

Sean sighed. ""I promised your wife I'd arrange a driver. Right now, that driver is me. Are you coming or not?""

""I'm not.""

Sean studied him for a moment, then turned toward the door. ""The toughest part of you has always been your mouth.""

Caleb was still in the room after Sean left. He looked between the door and Adrian, conflicted, then sighed heavily and sat back down.

""You're staying?"" Adrian's voice was rough.

""If we all leave, you'll just sit here drinking until you pass out. I can't do that to my conscience."" Caleb filled his own glass to the brim. ""Fine. You want to drink? I'll drink with you.""

Adrian's expression softened—barely. A fraction of a degree.

Caleb clinked their glasses together. ""For the record, I am one hundred percent loyal to you. You and Sean—you're both my idols.""

""You've got more heart than Wren Sutton.""

""Don't say that. Wren's great.""

Adrian scoffed. His eyes darkened.

If she's so great, why didn't she come?

Caleb's tolerance was far lower than Adrian's. Two bottles in, his tongue loosened entirely.

""Bro, you know what they say—never go to bed angry. Just go home, be sweet to Wren, and she'll forgive you. She's your wife. There's no shame in apologizing to your own wife. Get on your knees if you have to—roses in one hand, diamond necklace in the other—tell her you love her. Any woman would melt.

""And I don't care that I'm the youngest here, I understand women better than you do.

""Bro, I'm not trying to call you out, but you and Maya broke up. You shouldn't still be entangled with her. It's not fair to Wren. She cooks for you, keeps your house, warms your bed—how could you have the heart to hurt her?""

Adrian's grip on his glass tightened, but Caleb was too drunk to notice.

""And if you really don't love Wren anymore—then just divorce her. Let the woman go find her own happiness.""

""Enough."" Adrian's voice was ice. ""I'm not getting a divorce. And Wren would never agree to one.""

After all these years of luxury, of being Mrs. Lancaster—she wouldn't walk away from that willingly.

But Caleb, fortified by alcohol and youthful recklessness, barreled on.

""You don't know that. A woman's mind is impossible to read. If I were Wren and found out my husband was still wrapped around another woman's finger, I'd divorce him in a heartbeat. Then I'd find someone richer and better-looking and have a couple of kids with him.""

That last sentence was a grenade thrown into a room full of dynamite.

Adrian's vision went red. He seized Caleb by the collar and slammed him into the sofa cushions, one fist cocked back.

""Shut. Your. Mouth.""

Caleb let out a strangled squeak. His eyes rolled back. He slumped into the leather, passed out cold.

Adrian stared down at him, breathing hard.

Slowly, he unclenched his fist.

He wasn't drunk. If anything, he was getting more sober by the minute. And Caleb's words—the ones he wanted most to unhear—were lodging themselves like splinters in his brain.

Find someone richer and better-looking.

He and Wren hadn't seen each other in over a week. She claimed she was staying at Isla Griffith's place—but he hadn't verified that. Hadn't seen it with his own eyes.

What if she was lying?

What if she wasn't at Isla's at all?

What if there was someone else?

Adrian's heart slammed against his ribs. A murderous glint surfaced in his dark eyes.

If Wren Sutton is cheating on me, I will destroy the man. I don't care who he is.",https://video.fpnh1-2.fna.fbcdn.net/o1/v/t2/f2/m412/AQOWKz4hbR8m3d-1nkW98J7BaKwqpN5Hj2Ym869hQrUiTgyGqaqjWWSz7aQ7d_EzqQof_gBccuocb86fOkJakzKBAFKYFFSeWjsB6Kk-SQ.mp4?_nc_cat=109&_nc_oc=AdpsQ2xeMb1pLsDONolssi-rg32kIf4kJBSkvX4N3LRR_ddxCb6wEMhe-3v0Bgfy9nk&_nc_sid=8bf8fe&_nc_ht=video.fpnh1-2.fna.fbcdn.net&_nc_ohc=Dtn8sH6QdKsQ7kNvwHKyZcy&efg=eyJ2ZW5jb2RlX3RhZyI6Inhwdl9wcm9ncmVzc2l2ZS5WSV9VU0VDQVNFX1BST0RVQ1RfVFlQRS4uQzMuMzYwLnN2ZV9zZCIsInhwdl9hc3NldF9pZCI6MTEyODQ1MzcxOTM3Mjc2MywiYXNzZXRfYWdlX2RheXMiOjU5LCJ2aV91c2VjYXNlX2lkIjoxMDEzOSwiZHVyYXRpb25fcyI6MTUsInVybGdlbl9zb3VyY2UiOiJ3d3cifQ%3D%3D&ccb=17-1&_nc_gid=8ivZ6KqbPxBFz6l-jWTdNg&_nc_ss=7f289&_nc_zt=28&oh=00_Af7DGcoPwV5wWwnBlb2aNb_SmFc0dsqF1gTyud4rrVzjnA&oe=6A07D145
